{
  "schema_version": 1,
  "game": "RO 仙境传说 3 / Ragnarok Online 3",
  "created_at": "2026-07-27",
  "samples": [
    {
      "id": "daily-daidai-entry-icon-test-b-01",
      "icon_key": "daily_daidai_commission",
      "state": "entry_icon",
      "sample_type": "icon",
      "file": "crops/daily-daidai-entry-icon-test-b-01.png",
      "sha256": "86589fb859cc65682e25cc0338db646b2e72c1b81535ceecc2c3fa9cc041aebe",
      "dimensions": [
        40,
        41
      ],
      "source_id": "day1-guide-bv1yqtk6oekk",
      "source_timestamp_seconds": 466,
      "build": "TEST-B",
      "parent_frame": "research/evidence/video/day1-guide-bv1yqtk6oekk/frames/0466-daily-panel-expanded.png",
      "parent_sha256": "5ff69a7ecd600605455660fdf5538d0299455f1c8c6ae5a7b979cb84b183cbce",
      "crop": {
        "x": 129,
        "y": 152,
        "width": 40,
        "height": 41
      },
      "scale": {
        "applied": false,
        "algorithm": "none"
      },
      "confidence": "direct_clear",
      "recheck_in_cn_test": true,
      "contamination": {
        "watermark": false,
        "subtitles": false,
        "streamer_overlay": false,
        "notes": "裁区避开右上角模拟器广告与底部字幕。"
      },
      "limitations": [
        "只证明 TEST-B 条目徽记外观；不证明国服名称、位置或状态颜色。"
      ]
    },
    {
      "id": "daily-guild-caravan-entry-icon-test-b-01",
      "icon_key": "daily_guild_caravan",
      "state": "entry_icon",
      "sample_type": "icon",
      "file": "crops/daily-guild-caravan-entry-icon-test-b-01.png",
      "sha256": "34c8cfb34d2c44800850a32d05e4177a373e3271316ca9e59f701048d0e604bc",
      "dimensions": [
        31,
        41
      ],
      "source_id": "day1-guide-bv1yqtk6oekk",
      "source_timestamp_seconds": 466,
      "build": "TEST-B",
      "parent_frame": "research/evidence/video/day1-guide-bv1yqtk6oekk/frames/0466-daily-panel-expanded.png",
      "parent_sha256": "5ff69a7ecd600605455660fdf5538d0299455f1c8c6ae5a7b979cb84b183cbce",
      "crop": {
        "x": 347,
        "y": 152,
        "width": 31,
        "height": 41
      },
      "scale": {
        "applied": false,
        "algorithm": "none"
      },
      "confidence": "direct_clear",
      "recheck_in_cn_test": true,
      "contamination": {
        "watermark": false,
        "subtitles": false,
        "streamer_overlay": false,
        "notes": "裁区避开右上角模拟器广告与底部字幕。"
      },
      "limitations": [
        "这是入口徽记，不包含需求、库存、提交或完成状态。"
      ]
    },
    {
      "id": "daily-mvp-entry-icon-test-b-01",
      "icon_key": "daily_mvp",
      "state": "entry_icon",
      "sample_type": "icon",
      "file": "crops/daily-mvp-entry-icon-test-b-01.png",
      "sha256": "d9218bff016535c66b15d365d7105613209fa75642c7f7166b76b045b1b7be31",
      "dimensions": [
        40,
        41
      ],
      "source_id": "day1-guide-bv1yqtk6oekk",
      "source_timestamp_seconds": 466,
      "build": "TEST-B",
      "parent_frame": "research/evidence/video/day1-guide-bv1yqtk6oekk/frames/0466-daily-panel-expanded.png",
      "parent_sha256": "5ff69a7ecd600605455660fdf5538d0299455f1c8c6ae5a7b979cb84b183cbce",
      "crop": {
        "x": 129,
        "y": 211,
        "width": 40,
        "height": 41
      },
      "scale": {
        "applied": false,
        "algorithm": "none"
      },
      "confidence": "direct_clear",
      "recheck_in_cn_test": true,
      "contamination": {
        "watermark": false,
        "subtitles": false,
        "streamer_overlay": false,
        "notes": "裁区内只有游戏 UI。"
      },
      "limitations": [
        "MVP 属竞争场景排除类；该裁图不授权或支持自动参与。"
      ]
    },
    {
      "id": "daily-field-farming-entry-icon-test-b-01",
      "icon_key": "daily_field_farming",
      "state": "entry_icon",
      "sample_type": "icon",
      "file": "crops/daily-field-farming-entry-icon-test-b-01.png",
      "sha256": "6f002a78504d67c362cb0c6ab651d3ff2cc4091b18eb455b7edcf2c9a4126985",
      "dimensions": [
        31,
        41
      ],
      "source_id": "day1-guide-bv1yqtk6oekk",
      "source_timestamp_seconds": 466,
      "build": "TEST-B",
      "parent_frame": "research/evidence/video/day1-guide-bv1yqtk6oekk/frames/0466-daily-panel-expanded.png",
      "parent_sha256": "5ff69a7ecd600605455660fdf5538d0299455f1c8c6ae5a7b979cb84b183cbce",
      "crop": {
        "x": 347,
        "y": 211,
        "width": 31,
        "height": 41
      },
      "scale": {
        "applied": false,
        "algorithm": "none"
      },
      "confidence": "direct_clear",
      "recheck_in_cn_test": true,
      "contamination": {
        "watermark": false,
        "subtitles": false,
        "streamer_overlay": false,
        "notes": "裁区内只有游戏 UI。"
      },
      "limitations": [
        "入口徽记不能证明加倍、低倍或疲劳阶段。"
      ]
    },
    {
      "id": "daily-life-entry-icon-test-b-01",
      "icon_key": "daily_life_play",
      "state": "entry_icon",
      "sample_type": "icon",
      "file": "crops/daily-life-entry-icon-test-b-01.png",
      "sha256": "ea2516ea6958bca5da1682f0626292fab7036f91c3471a7def71f43cc7b8afd6",
      "dimensions": [
        40,
        41
      ],
      "source_id": "day1-guide-bv1yqtk6oekk",
      "source_timestamp_seconds": 466,
      "build": "TEST-B",
      "parent_frame": "research/evidence/video/day1-guide-bv1yqtk6oekk/frames/0466-daily-panel-expanded.png",
      "parent_sha256": "5ff69a7ecd600605455660fdf5538d0299455f1c8c6ae5a7b979cb84b183cbce",
      "crop": {
        "x": 129,
        "y": 270,
        "width": 40,
        "height": 41
      },
      "scale": {
        "applied": false,
        "algorithm": "none"
      },
      "confidence": "direct_clear",
      "recheck_in_cn_test": true,
      "contamination": {
        "watermark": false,
        "subtitles": false,
        "streamer_overlay": false,
        "notes": "裁区内只有游戏 UI。"
      },
      "limitations": [
        "入口徽记不包含 4/5、5/5、活力不足或满包状态。"
      ]
    },
    {
      "id": "daily-spirit-tower-entry-icon-test-b-01",
      "icon_key": "daily_spirit_tower",
      "state": "entry_icon",
      "sample_type": "icon",
      "file": "crops/daily-spirit-tower-entry-icon-test-b-01.png",
      "sha256": "3f617bf677525d4e5120a07f9a1e525216870a812e12d0b4781a97e0136418db",
      "dimensions": [
        31,
        41
      ],
      "source_id": "day1-guide-bv1yqtk6oekk",
      "source_timestamp_seconds": 466,
      "build": "TEST-B",
      "parent_frame": "research/evidence/video/day1-guide-bv1yqtk6oekk/frames/0466-daily-panel-expanded.png",
      "parent_sha256": "5ff69a7ecd600605455660fdf5538d0299455f1c8c6ae5a7b979cb84b183cbce",
      "crop": {
        "x": 347,
        "y": 270,
        "width": 31,
        "height": 41
      },
      "scale": {
        "applied": false,
        "algorithm": "none"
      },
      "confidence": "direct_clear",
      "recheck_in_cn_test": true,
      "contamination": {
        "watermark": false,
        "subtitles": false,
        "streamer_overlay": false,
        "notes": "裁区内只有游戏 UI。"
      },
      "limitations": [
        "只保存入口徽记；层数、失败和结算状态仍缺。"
      ]
    },
    {
      "id": "daily-daidai-completed-row-test-b-01",
      "icon_key": "daily_daidai_commission",
      "state": "completed_label_visible",
      "sample_type": "state_row",
      "file": "crops/daily-daidai-completed-row-test-b-01.png",
      "sha256": "56e41f7dcd90aa4964a7e5dc8e0f188e83a1522829fd63715628179760801208",
      "dimensions": [
        225,
        59
      ],
      "source_id": "day1-guide-bv1yqtk6oekk",
      "source_timestamp_seconds": 466,
      "build": "TEST-B",
      "parent_frame": "research/evidence/video/day1-guide-bv1yqtk6oekk/frames/0466-daily-panel-expanded.png",
      "parent_sha256": "5ff69a7ecd600605455660fdf5538d0299455f1c8c6ae5a7b979cb84b183cbce",
      "crop": {
        "x": 108,
        "y": 141,
        "width": 225,
        "height": 59
      },
      "scale": {
        "applied": false,
        "algorithm": "none"
      },
      "confidence": "direct_clear",
      "recheck_in_cn_test": true,
      "contamination": {
        "watermark": false,
        "subtitles": false,
        "streamer_overlay": false,
        "notes": "裁区包含完整游戏内条目，不含视频字幕。"
      },
      "limitations": [
        "只证明“已完成”行状态；没有接取到交付的连续过程。"
      ]
    },
    {
      "id": "activity-reward-green-check-test-b-01",
      "icon_key": "activity_reward_chest",
      "state": "green_check_candidate",
      "sample_type": "state_indicator",
      "file": "crops/activity-reward-green-check-test-b-01.png",
      "sha256": "d18b9cb8cb8287722ecfe62f6cc831268bcd4e88e1a5184cd3b631df8ab7a3f3",
      "dimensions": [
        40,
        41
      ],
      "source_id": "day1-guide-bv1yqtk6oekk",
      "source_timestamp_seconds": 466,
      "build": "TEST-B",
      "parent_frame": "research/evidence/video/day1-guide-bv1yqtk6oekk/frames/0466-daily-panel-expanded.png",
      "parent_sha256": "5ff69a7ecd600605455660fdf5538d0299455f1c8c6ae5a7b979cb84b183cbce",
      "crop": {
        "x": 230,
        "y": 340,
        "width": 40,
        "height": 41
      },
      "scale": {
        "applied": false,
        "algorithm": "none"
      },
      "confidence": "contextual_candidate",
      "recheck_in_cn_test": true,
      "contamination": {
        "watermark": false,
        "subtitles": false,
        "streamer_overlay": false,
        "notes": "裁区避开底部视频字幕。"
      },
      "limitations": [
        "单帧无法区分“达到可领”与“已经领取”，因此保持候选态。"
      ]
    },
    {
      "id": "activity-reward-locked-chest-test-b-01",
      "icon_key": "activity_reward_chest",
      "state": "threshold_not_reached_closed_chest",
      "sample_type": "state_indicator",
      "file": "crops/activity-reward-locked-chest-test-b-01.png",
      "sha256": "8885a9f413fbacab9996311d1ee7c64e092dd2eab3456266c967896dbacad4fa",
      "dimensions": [
        40,
        41
      ],
      "source_id": "day1-guide-bv1yqtk6oekk",
      "source_timestamp_seconds": 466,
      "build": "TEST-B",